region,code,nom,nb_bv,inscrits,votants,taux_participation,nuls,exprimes,bulletins_blancs,taux_bulletins_blancs
MORONOU,161,"ANOUMABA ET TIEMELEKRO, COMMUNES ET SOUS-PREFECTURES",65,19083,8372,43.87,317,8055,80,0.99
MORONOU,162,"ASSAHARA ET M'BATTO, COMMUNES ET SOUS-PREFECTURES",83,27427,9770,35.62,446,9324,59,0.63
NAWA,148,"DABOUYO ET GUEYO, COMMUNES ET SOUS-PREFECTURES",73,19218,5564,28.95,202,5362,50,0.93
NAWA,149,"BUYO ET DAPEOUA, COMMUNES ET SOUS-PREFECTURES",115,27640,6852,24.79,323,6529,99,1.52
NAWA,150,"GNAMANGUI, MEAGUI ET OUPOYO, COMMUNES ET SOUS-PREFECTURES",214,57090,12968,22.72,671,12297,136,1.11
NAWA,151,"GRAND-ZATIRY, COMMUNES ET SOUS-PREFECTURE",70,19273,6190,32.12,244,5946,49,0.82
