region,code,nom,nb_bv,inscrits,votants,taux_participation,nuls,exprimes,bulletins_blancs,taux_bulletins_blancs
NAWA,152,"LILIYO ET OKROUYO, COMMUNES ET SOUS-PREFECTURES",145,34787,9285,26.69,409,8876,117,1.32
NAWA,153,"SOUBRE, COMMUNES ET SOUS-PREFECTURE",160,53618,9246,17.24,301,8945,79,0.88
N'ZI,155,"BENGASSOU, BOCANDA, KOUADIOBLEKRO ET N'ZECREZESSOU, COMMUNES ET SOUS-PREFECTURES",157,44988,18242,40.55,791,17451,252,1.44
N'ZI,156,"KOUASSI-KOUASSIKRO, COMMUNES ET SOUS-PREFECTURE",46,13333,5319,39.89,227,5092,70,1.37
N'ZI,159,"ABIGUI, DIANGOKRO ET NOFOU, COMMUNES ET SOUS-PREFECTURES",50,13202,5902,44.71,216,5686,53,0.93
N'ZI,160,"DIMBOKRO, COMMUNE ET SOUS-PREFECTURE",99,36237,10564,29.15,401,10163,64,0.63
