region,code,nom,nb_bv,inscrits,votants,taux_participation,nuls,exprimes,bulletins_blancs,taux_bulletins_blancs
KABADOUGOU,124,"KIMBIRILA-SUD, TIEME, SAMATIGUILA, ET SAMANGO, COMMUNES ET SOUS-PREFECTURES, ODIENNE, SOUS PREFECTURE",87,26474,17165,64.84,244,16921,152,0.9
LA ME,141,"ADZOPE, COMMUNE",88,34787,12179,35.01,3423,8756,42,0.48
LA ME,142,"AGOU, BECEDI-BRIGNAN ET YAKASSE-ME, COMMUNES ET SOUS-PREFECTURES",86,32407,10322,31.85,270,10052,70,0.7
LA ME,143,"ADZOPE, SOUS-PREFECTURE, ANNEPE ET ASSIKOI, COMMUNES ET SOUS-PREFECTURES",89,33376,12344,36.98,268,12076,97,0.8
LA ME,144,"AFFERY, COMMUNE ET SOUS-PREFECTURE",41,16380,6980,42.61,287,6693,20,0.3
