region,code,nom,nb_bv,inscrits,votants,taux_participation,nuls,exprimes,bulletins_blancs,taux_bulletins_blancs
LOH-DJIBOUA,128,"DAIRO-DIDIZO ET GUITRY, COMMUNES ET SOUS-PREFECTURES",118,30986,13544,43.71,276,13268,160,1.21
LOH-DJIBOUA,129,"LAUZOUA ET YOCOBOUE, COMMUNES ET SOUS-PREFECTURES",50,12142,5036,41.48,139,4897,91,1.86
LOH-DJIBOUA,130,"DJIDJI, GAGORE ET ZIKISSO, COMMUNES ET SOUS-PREFECTURES",45,13640,4476,32.82,156,4320,58,1.34
LOH-DJIBOUA,131,"GOUDOUKO ET NIAMBEZARIA, COMMUNES ET SOUS-PREFECTURES",68,18404,6693,36.37,242,6451,74,1.15
LOH-DJIBOUA,132,"LAKOTA, COMMUNE ET SOUS-PREFECTURE",118,38754,8724,22.51,250,8474,70,0.83
